### ISSUE TITLE
Sentinel accepts TLS certificates in constructor, but doesn't appear to honor them

### ISSUE THREAD

**Issue by slmingol** [andymccurdy/redis-py#1002]
I'm attempting to use TLS/SL certificates with the Sentinel constructor. It appears to support them but they don't actually appear to do anything. Here's a sample script:

```
#!/usr/bin/env python

# ./test_sentinel.py --host redissent3.aa.mydom.com --port 26380 -t
# ./test_sentinel.py --host redissent3.aa.mydom.com --port 26379

import argparse
import pprint
from redis.sentinel import Sentinel

parser = argparse.ArgumentParser(description='TLS check.', add_help=False)
parser.add_argument('--host', '-h', help='endpoint host', default='localhost')
parser.add_argument('--port', '-p', help='endpoint port', type=int, default=6379)
parser.add_argument('--tls', '-t', help='endpoint tls', action='store_true')
args = parser.parse_args()

try:
    if args.tls:
        conn = Sentinel([(args.host, args.port)], ssl=True, ssl_ca_certs='ca-chain.cert.pem',ssl_certfile='user_cert.pem', ssl_keyfile='user_key.pem')
    else:
        conn = Sentinel([(args.host, args.port)], ssl=False)
    print 'Connected!'
    pprint.pprint(conn.discover_master('artim-sessions'))

except Exception as ex:
        print 'Error:', ex
        exit('Failed to connect, terminating.')
```

Sample runs:

```
# Use TLS
./test_sentinel.py --host redissent3.aa.mydom.com --port 26380 -t
Connected!
Error: No master found for 'artim-sessions'
Failed to connect, terminating.

# No TLS
./test_sentinel.py --host redissent3.aa.mydom.com --port 26379
Connected!
('10.25.203.105', 6379)
```

We're using HAProxy to act as a reverse proxy and terminate TLS connections on port 26380 and then call the actual sentinel daemon that's running on localhost:26379. 

Running `tcpdump` commands on the redissent3 node shows that whether we enable/disable the use of TLS/SSL in the client, the calls coming through to port 26380 are in fact not over TLS at all.

```
$ tcpdump -i any -vnnXSs0 port 26380
...
12:47:35.100206 IP (tos 0x0, ttl 64, id 40444, offset 0, flags [DF], proto TCP (6), length 60)
    10.25.203.105.34692 > 10.25.203.17.26380: Flags [S], cksum 0x55bd (correct), seq 1987113867, win 29200, options [mss 1460,sackOK,TS val 243363447 ecr 0,nop,wscale 7], length 0
	0x0000:  4500 003c 9dfc 4000 4006 f212 0a19 cb69  E..<..@.@......i
	0x0010:  0a19 cb11 8784 670c 7670 f38b 0000 0000  ......g.vp......
	0x0020:  a002 7210 55bd 0000 0204 05b4 0402 080a  ..r.U...........
	0x0030:  0e81 6e77 0000 0000 0103 0307 0000 0000  ..nw............
	0x0040:  0000 0000 0000 0000 0000 0000            ............
12:47:35.100324 IP (tos 0x0, ttl 64, id 40445, offset 0, flags [DF], proto TCP (6), length 52)
    10.25.203.105.34692 > 10.25.203.17.26380: Flags [.], cksum 0x157c (correct), ack 1833516704, win 229, options [nop,nop,TS val 243363447 ecr 243344830], length 0
	0x0000:  4500 0034 9dfd 4000 4006 f219 0a19 cb69  E..4..@.@......i
	0x0010:  0a19 cb11 8784 670c 7670 f38c 6d49 3ea0  ......g.vp..mI>.
	0x0020:  8010 00e5 157c 0000 0101 080a 0e81 6e77  .....|........nw
	0x0030:  0e81 25be 2a32 0d0a 2438 0d0a 5345 4e54  ..%.*2..$8..SENT
	0x0040:  494e 454c                                INEL
12:47:35.100403 IP (tos 0x0, ttl 64, id 40446, offset 0, flags [DF], proto TCP (6), length 83)
    10.25.203.105.34692 > 10.25.203.17.26380: Flags [P.], cksum 0xfb61 (correct), seq 1987113868:1987113899, ack 1833516704, win 229, options [nop,nop,TS val 243363447 ecr 243344830], length 31
	0x0000:  4500 0053 9dfe 4000 4006 f1f9 0a19 cb69  E..S..@.@......i
	0x0010:  0a19 cb11 8784 670c 7670 f38c 6d49 3ea0  ......g.vp..mI>.
	0x0020:  8018 00e5 fb61 0000 0101 080a 0e81 6e77  .....a........nw
	0x0030:  0e81 25be 2a32 0d0a 2438 0d0a 5345 4e54  ..%.*2..$8..SENT
	0x0040:  494e 454c 0d0a 2437 0d0a 4d41 5354 4552  INEL..$7..MASTER
	0x0050:  530d 0a00 0000 0000 0000 0000 0000 0000  S...............
	0x0060:  0000 00                                  ...
12:47:35.100681 IP (tos 0x0, ttl 64, id 40447, offset 0, flags [DF], proto TCP (6), length 52)
    10.25.203.105.34692 > 10.25.203.17.26380: Flags [F.], cksum 0x1559 (correct), seq 1987113899, ack 1833516705, win 229, options [nop,nop,TS val 243363448 ecr 243344831], length 0
	0x0000:  4500 0034 9dff 4000 4006 f217 0a19 cb69  E..4..@.@......i
	0x0010:  0a19 cb11 8784 670c 7670 f3ab 6d49 3ea1  ......g.vp..mI>.
	0x0020:  8011 00e5 1559 0000 0101 080a 0e81 6e78  .....Y........nx
	0x0030:  0e81 25bf 0000 0000 0103 0307 0000 0000  ..%.............
	0x0040:  0000 0000                                ....
12:47:35.101192 IP (tos 0x0, ttl 64, id 3135, offset 0, flags [DF], proto TCP (6), length 60)
    10.25.203.105.34694 > 10.25.203.17.26380: Flags [S], cksum 0x6baf (correct), seq 4055851591, win 29200, options [mss 1460,sackOK,TS val 243363448 ecr 0,nop,wscale 7], length 0
	0x0000:  4500 003c 0c3f 4000 4006 83d0 0a19 cb69  E..<.?@.@......i
	0x0010:  0a19 cb11 8786 670c f1bf 6247 0000 0000  ......g...bG....
	0x0020:  a002 7210 6baf 0000 0204 05b4 0402 080a  ..r.k...........
	0x0030:  0e81 6e78 0000 0000 0103 0307 0000 0000  ..nx............
	0x0040:  0000 0000 0000 0000 0000 0000            ............
12:47:35.101291 IP (tos 0x0, ttl 64, id 3136, offset 0, flags [DF], proto TCP (6), length 52)
    10.25.203.105.34694 > 10.25.203.17.26380: Flags [.], cksum 0x89b5 (correct), ack 3168243913, win 229, options [nop,nop,TS val 243363448 ecr 243344831], length 0
	0x0000:  4500 0034 0c40 4000 4006 83d7 0a19 cb69  E..4.@@.@......i
	0x0010:  0a19 cb11 8786 670c f1bf 6248 bcd7 90c9  ......g...bH....
	0x0020:  8010 00e5 89b5 0000 0101 080a 0e81 6e78  ..............nx
	0x0030:  0e81 25bf 2a32 0d0a 2438 0d0a 5345 4e54  ..%.*2..$8..SENT
	0x0040:  494e 454c                                INEL
12:47:35.101342 IP (tos 0x0, ttl 64, id 3137, offset 0, flags [DF], proto TCP (6), length 83)
    10.25.203.105.34694 > 10.25.203.17.26380: Flags [P.], cksum 0x6f9b (correct), seq 4055851592:4055851623, ack 3168243913, win 229, options [nop,nop,TS val 243363448 ecr 243344831], length 31
	0x0000:  4500 0053 0c41 4000 4006 83b7 0a19 cb69  E..S.A@.@......i
	0x0010:  0a19 cb11 8786 670c f1bf 6248 bcd7 90c9  ......g...bH....
	0x0020:  8018 00e5 6f9b 0000 0101 080a 0e81 6e78  ....o.........nx
	0x0030:  0e81 25bf 2a32 0d0a 2438 0d0a 5345 4e54  ..%.*2..$8..SENT
	0x0040:  494e 454c 0d0a 2437 0d0a 4d41 5354 4552  INEL..$7..MASTER
	0x0050:  530d 0a00 0000 0000 0000 0000 0000 0000  S...............
	0x0060:  0000 00                                  ...
12:47:35.101523 IP (tos 0x0, ttl 64, id 3138, offset 0, flags [DF], proto TCP (6), length 52)
    10.25.203.105.34694 > 10.25.203.17.26380: Flags [.], cksum 0x8993 (correct), ack 3168243914, win 229, options [nop,nop,TS val 243363449 ecr 243344832], length 0
	0x0000:  4500 0034 0c42 4000 4006 83d5 0a19 cb69  E..4.B@.@......i
	0x0010:  0a19 cb11 8786 670c f1bf 6267 bcd7 90ca  ......g...bg....
	0x0020:  8010 00e5 8993 0000 0101 080a 0e81 6e79  ..............ny
	0x0030:  0e81 25c0 0000 0000 0103 0307 0000 0000  ..%.............
	0x0040:  0000 0000                                ....
12:47:35.101569 IP (tos 0x0, ttl 64, id 3139, offset 0, flags [DF], proto TCP (6), length 52)
    10.25.203.105.34694 > 10.25.203.17.26380: Flags [F.], cksum 0x8992 (correct), seq 4055851623, ack 3168243914, win 229, options [nop,nop,TS val 243363449 ecr 243344832], length 0
	0x0000:  4500 0034 0c43 4000 4006 83d4 0a19 cb69  E..4.C@.@......i
	0x0010:  0a19 cb11 8786 670c f1bf 6267 bcd7 90ca  ......g...bg....
	0x0020:  8011 00e5 8992 0000 0101 080a 0e81 6e79  ..............ny
	0x0030:  0e81 25c0 2a32 0d0a 2438 0d0a 5345 4e54  ..%.*2..$8..SENT
	0x0040:  494e 454c                                INEL
```
